page,country,job_link,search_keyword,search_location,job_title,company_name,company_location,salary,job_description_new
12,France,https://www.indeed.fr/rc/clk?jk=e3b8149dd8ec1735&bb=vo8bM3VJ_e5-ZWMcwV_OvYuwFFpSLrMcy0L6lpt2Q4styCBK-l3AhKmiBjhmXsnsdqzh3jE7T3RvC_WDIvcmOIBvCCoCRt8-U7Jdf0La-Hhjrm2Xahfacx69C1kmRcHi&xkcb=SoCK67M37J7TEFxqw50HbzkdCdPP&fccid=d80709278da21ef7&vjs=3,Data+Analyst,Paris (75),Business Analyst & Market Intelligence Apprentice,Beyond Aero,Télétravail partiel à 75008 Paris,,"Aviation will be electric
We believe that aviation will only be electric in the next decades, and we are fully committed to making this a reality, by building the first electric business aircraft using hydrogen propulsion to fly up to 800 NM, five times further than a battery-powered aircraft.

We deeply value caring for our team of Beyonders fostering a culture of trust and collaboration. We constantly aim to explore new horizons and continuously raise our standards, while maintaining a pragmatic mindset. Above all, we are all driven by one mission : Make possible, certifiable and profitable the first private aircraft designed for hydrogen-electric propulsion.


About the role
As a Business Analyst, Market Intelligence Work-Study at Beyond Aero, you'll play a crucial role in shaping our data-driven marketing strategies that target specific persona criteria and align with our Product Team's requirements. This role focuses on deep data analysis, understanding market trends, and providing actionable insights to drive our brand strategy.


In details you will :


Collaborate with the Product Department to identify client needs, conduct thorough market research, and gather critical data insights for marketing initiatives,
Analyze market data to develop comprehensive reports and actionable recommendations for marketing strategies,
Support the development and execution of data-driven marketing campaigns, including in-house events, press relations, and industry fairs,
Participate in brainstorming sessions to generate innovative marketing ideas and strategies backed by data analysis and market trends,
Assist in the creation and maintenance of dashboards and reports to track key marketing metrics and performance indicators.
About you
Currently enrolled in a marketing, business, data science, or related Masters program
A strong interest in market intelligence, data analysis, and a desire to gain practical experience in a data-oriented marketing environment
Exceptional analytical skills with the ability to interpret complex data and provide actionable insights
Proficiency in data analysis tools (e.g., Excel, SQL, Tableau) and basic computer applications.
Ability to work independently and collaboratively in a team environment
Availability to work a flexible schedule that accommodates your academic commitments
Joining us will allow you to :

Have a hands-on experience in a dynamic marketing environment with a focus on persona-driven marketing
Mentorship and guidance from experienced Marketing professionals
Work in an international and friendly work environment (10 nationalities)
Work in a flexible work organization and access to partial remote work
If you thrive in a fast-paced, pioneering & flexible environmment where care and hunger for growth are celebrated, join us !

Beyond Aero is an Equal Opportunity Employer. All qualified applicants will receive consideration for employment without regard to race, sex, gender, sexual orientation, age, colour, religion, national origin, protected veteran status or on the basis of disability."
12,France,https://www.indeed.fr/rc/clk?jk=3c51390fba50265c&bb=vo8bM3VJ_e5-ZWMcwV_OvVNt3hCUEbrGs44cSFeSwvhbJbqbIu53Tu8FApv4hGEke1KAbYpY1KCT0IWJ21cuTsbDcdaFemoHS-Dz8z_PsC7qcOljOPHleJPPt3XubDQM&xkcb=SoCj67M37J7TEFxqw50FbzkdCdPP&fccid=901ca5f79bf74c11&vjs=3,Data+Analyst,Paris (75),Data Analyst Intern,FoxIntelligence,Paris (75),,"Chez Foxintelligence, nous sommes des amoureux de la data.

Notre mission est de rendre les consommateurs et les marques plus intelligents, grâce à une donnée de marché révolutionnaire issue de l’intelligence collective. Pour les consommateurs, Foxintelligence rend accessibles et utiles leurs données transactionnelles issues de leurs boîtes mail ou comptes bancaires. En les anonymisant, nous créons des statistiques uniques qui permettent aux marques de rester en phase avec les produits qui se vendent le mieux et les attentes des consommateurs.

Nous publions une application grand public aimée par des millions de personnes (Cleanfox, 15m+ de téléchargements, 4.8/5 sur l’app store et le play store) et préparons le lancement d’une app de bilan carbone à l’expérience radicalement nouvelle. Grâce à notre plateforme data, elle va rendre possible une prise de conscience massive des enjeux du changement climatique et des actions individuelles possibles pour le combattre. Nous pensons que l’information est une force de changement puissante, lorsqu’elle s’appuie sur la data.

Utilisant ces données personnelles totalement anonymisées, notre plateforme SaaS foxintelligence.io est devenue la référence de la market intelligence digitale en Europe avec des dizaines de grands groupes clients. Le point commun entre Deliveroo, Just Eat, Mano Mano, BackMarket ou The Boston Consulting Group ? Ils vont très vite (on ne s’ennuie pas avec eux !) et ils nous font tous confiance !

Soutenus par des investisseurs de premier plan (17m levés auprès de Daphni, Partech, GFC et eFounders) et récemment intégré au groupe NielsenIQ nous sommes maintenant à la conquête de l’Europe et en phase d’hyper-croissance.

Si notre FoxHQ reste à Paris, notre équipe de plus de 140 talents pluridisciplinaires (tech, data et business) travaille depuis partout en France et même en dehors (ex. Turquie). Nous pensons que notre politique remote-first, notre culture forte (bienveillance, exigence, résilience et data-first) et notre innovation permanente en termes de modes de travail (ex. grille de salaire transparente, formation au changement climatique, transparence sur la stratégie) sont les clés de notre réussite collective…. et de ta réussite avec nous !

Job Description
Foxintelligence recherche un(e) stagiaire Data Analyst.

Tu seras rattaché(e) à l’équipe Data Management et tu interviendras au niveau de l’enrichissement de la donnée. Cet enrichissement rend possible l’analyse de la donnée par nos équipes analytics et nos clients. Ton rôle sera de garantir que les champs enrichis aient le niveau de completion et de qualité attendues sur l’ensemble de nos industries (e-commerce, food delivery etc.) et territoires couverts (7 pays européens, ainsi que l’Inde).

Tes responsabilités au quotidien :

Analyses : Faire des analyses approfondies sur une variété d’enrichissements comme l’âge des consommateurs ou la géolocalisation des commandes. Remettre en question ces enrichissements, identifier les améliorations nécessaires et aider à construire la roadmap qui nous permettra de scaler à l’international.
Qualité des données : Etre responsable d'une partie de la roadmap d'enrichissements, garantir la qualité de ces enrichissements et leur disponibilité à la date attendue. Travailler main dans la main avec les équipes commerciales pour répondre à leurs besoins avec les données les plus pertinentes.
Automatisation & Scale : Construire des outils de productivité à destination de ton équipe pour permettre de gagner en efficacité (définition de process transverses, automatisation de tâches avec Python, mise à disposition de dashboards Tableau/Looker d’investigations etc…).
Projets stratégiques : Participer à des initiatives majeures et à fort potentiel pour Fox sur le plan Data. A titre d’exemple, deux de nos challenges actuels sont l’intégration avec NielsenIQ pour rendre possibles des analyses omnicanales (online/offline) et l'ouverture de plusieurs nouveaux marchés simultanément.
Requirements

Compétences nécessaires (ce qu’il te faut pour réussir sur ce poste) :

Soft Skills

Tu sais résoudre des problèmes complexes en appliquant un raisonnement structuré basé sur la data
Tu aimes les challenges et as envie d’apprendre dans un environnement en hyper croissance
Tu es proactif(ve) et cherches à optimiser des process, pour être toujours plus efficace
Hard skills

Tu maîtrises un ou plusieurs langages de programmation (SQL est un plus)
Tu sais manipuler de larges bases de données
Tu as déjà utilisé des outils de data visualization
Compétences bonus

Tu as une première expérience en data dans des startups/boites tech ou au sein d’une société de conseil
Tu es familier des problématiques business du e-commerce
Tu maitrises de Tableau, Github, Regex
Ladies

Les études montrent que les femmes ont moins tendance à postuler à une offre d’emploi quand elles n’ont pas toutes les qualifications requises. Ladies, ne vous mettez pas de barrière et donnez-nous la chance de nous faire notre propre avis, nous serons toujours ravis d’échanger avec vous ! Si notre raison d’être vous parle, postulez !

Self-made data lovers

Les diplômes c’est bien, les skills c’est mieux et l’expérience t’en donne. Aucun diplôme n’est requis chez nous, c’est les compétences et l’énergie qui comptent !

Recruitment process
Round 0 : entretien (fit) avec un membre notre équipe HR
Round 1 : entretien (expérience et fit) avec un(e) Senior Data Analyst de l'équipe
Round 2 : test technique
Decision Round : entretien avec notre Lead Data Analyst
Benefits

Avantages/ce que nous offrons


Rémunération Compétitive
Remote friendly (+ budget aménagement de l’espace de travail @Home)
Carte ticket restaurants (Swile) pris en charge à 60% par Fox
Culture forte et pratiques de management à la pointe (stratégie et résultats financiers transparents, feedback 360, grille de salaire innovante et transparente etc."
4,France,https://www.indeed.fr/rc/clk?jk=ef4a7ca773a26d9e&bb=sm8v57bljitY5FgY_4bxZJRieDn-Jyrs7EuBIHSJqBlqUW-4M9hp8vVzK9VM_kA2JkG5rIaUE4AAMX-Cm-9eHn_v2pPVLeL8t1PdGMCgLdYrsjUW-lG9YQ%3D%3D&xkcb=SoAR67M37KKv3i29r50KbzkdCdPP&fccid=43a69183767d4301&vjs=3,Data+Analyst,Lyon (69),Business Analyst Secteur Energie F/H,CGI,69009 Lyon,,"Créer un profil | Ouvrir une session
Activer des alertes carrières
X sharing link
facebook sharing link
linkedin sharing link
xing sharing link
email sharing link
Consulter des offres d'emploi similaires
Business Analyst Secteur Energie F/H
Catégorie : Analyse d’affaires (fonctionnelle et technique)
Localisation principale : France, Rhône, Lyon
No de poste : J0624-0208
Type d’emploi : Diplômé
jobimage
CGI France : Business Analyst
CGI Video Preview Image
En visionnant cette vidéo, vous acceptez que Google/YouTube traite vos données et utilise des cookies – En savoir plus.
Description du poste :
Vous rejoignez CGI, leader mondial du conseil et des services numériques à Lyon et accompagnez nos clients.

Data, cloud, automatisation, modernisation des SI... Nos équipes accompagnent les énergéticiens dans la définition de nouveaux modèles d’affaires et la création de nouvelles offres pour répondre aux enjeux de la transition énergétique.

Fonctions et responsabilités :
Après un parcours de formation orienté sur les spécificités de la filière nucléaire, vous rejoindrez une équipe composée d’acteurs CGI et client.
Selon vos compétences, votre mission sera orientée sur l’un des axes suivants :
• La définition et la mise en œuvre de processus (Métier, Qualité…)
• Le recueil de besoin auprès des utilisateurs finaux : via l’animation d’atelier Métier, la conception fonctionnelle, la rédaction de schémas et livrables
• La définition de nouvelles solutions digitales en lien avec les Architectes et Experts techniques
• La définition de la stratégie de tests et sa mise en œuvre
• L’accompagnement aux changements auprès des utilisateurs sur le terrain
• La modélisation de calculs scientifiques ou mécaniques
• La mise en place des outils de gestion de projet et l’automatisation d’activités récurrentes
• La collecte et l’analyse de données
• La mise en place de nouveaux reportings
• Etc.

En rejoignant CGI, vous bénéficiez notamment d’une offre complète de formations (techniques, métiers, développement personnel,…), de flexibilité grâce à notre accord télétravail (jusqu’à 3 jours de télétravail par semaine), d’une politique de congés avantageuse (27 jours de congés payés, RTT, congés ancienneté et enfant malade,…) et d’un package d’avantages intéressant (régime d’achats d’actions, participation, CSE,...).

Qualités requises pour réussir dans ce rôle :
• Formation : Bac + 5 (Ecole d’ingénieurs ou Université)
• Travail d’équipe et esprit de partage
• Méthodologies de conception (UML, UX Design, etc.) et de stratégies de tests
• Appétence pour le secteur de l’énergie
• Force de proposition
• Envie de challenge

CGI est un employeur inclusif et attentif aux candidatures des personnes en situation de handicap, à l’évolution de carrières des hommes et des femmes et au bien-être de nos salariés LGBT+. Dans un souci d’accessibilité et de clarté, le point médian n’est pas utilisé dans cette annonce. Tous les termes employés se réfèrent aussi bien au genre féminin que masculin.

Compétences :
Relation client
Communication (orale/écrite)
UML (Unified ModelingLanguage)
UX design
Ce que vous pouvez attendre de nous :
Ensemble, en tant que propriétaires, mettons notre savoir-faire à l’œuvre.

La vie chez CGI est ancrée dans l’actionnariat, le travail d’équipe, le respect et un sentiment d’appartenance. Chez nous, vous pourrez exploiter votre plein potentiel parce que…

Nous vous invitons à devenir propriétaire dès le jour 1 alors que nous travaillons ensemble à faire de notre rêve une réalité. C’est pourquoi nous nous désignons comme associés de CGI, plutôt que comme employés. Nous tirons profit des retombées de notre succès collectif et contribuons activement à l’orientation et à la stratégie de notre entreprise.

Votre travail crée de la valeur. Vous élaborerez des solutions novatrices et développerez des relations durables avec vos collègues et clients, tout en ayant accès à des capacités mondiales pour concrétiser vos idées, saisir de nouvelles opportunités, et bénéficier d’une expertise sectorielle et technologique de pointe.

Vous ferez évoluer votre carrière en vous joignant à une entreprise bâtie pour croître et durer. Vous serez soutenus par des leaders qui ont votre santé et bien-être à cœur et qui vous permettront de saisir des occasions afin de parfaire vos compétences et élargir les horizons.

Joignez-vous à nous, l’une des plus importantes entreprises de conseil en technologie de l’information (TI) et en management au monde."
1,France,https://www.indeed.fr/rc/clk?jk=f5187958b28078ff&bb=5iw9r44d2hGM3tYpd5ZIhB1dju4QaxrTf715nfCncbUOp_5T3qTPBNBIpzKIMrZeUeclr3BJ5VQ4IRmaaq42pEhj9uvwskLKn2QVR6ydMwFaM-X1YfTr-VxrT-mBV2nM&xkcb=SoBP67M37KUJvvW9mx0ZbzkdCdPP&fccid=59b0276335be5b2d&vjs=3,BI+Analyst,Paris (75),Discount & Rebates Analyst - CDD 6 mois (H/F),Essity,Paris (75),,"Discount & Rebates Analyst - CDD 6 mois (H/F)

La/Le Gestionnaire des Budgets Commerciaux est l’interlocuteur des clients (internes et externes), il administre et gère de façon autonome et en équipe les budgets commerciaux (on et off invoice, NiP, accords internationaux), les provisions, les déclarations de chiffres d’affaires et les rapports internes.
Elle/Il sera également amené.e à gérer ou superviser des missions transversales interservices (process nouveaux produits, Sharepoint, support Equipes commerciales).

Il s'agit d'un poste en CDD à pourvoir sur notre site de Saint-Ouen (93).

A propos du poste

Nous recherchons des personnes qui incarnent nos valeurs et qui ont envie de relever des défis, d’innover, d’expérimenter et de progresser rapidement. Nous sommes acteurs de l’amélioration de nos produits et du développement de chacun de nous-mêmes. Si vous vous inscrivez dans cette dynamique, montrez-le en nous envoyant votre candidature personnalisée.

Ce que vous allez faire

Vous aurez des missions diversifiées à mener à la fois de façon autonome et en équipe, sur l’intégralité de nos catégories et clients, dont les principales sont :

Participer à la mise en place et à l’analyse de chaque phase des prévisions budgétaires, en contact étroit avec les KAM et service Controlling

Réaliser et partager l’analyse des changements après chaque révision des prévisons budgétaires

Assurer la mise en place et la mise à jour des provisions dans SAP en coordination avec les équipes commerciales et le service controlling

Garantir la gestion budgétaire des accords commerciaux, notamment au travers du traitement des factures, ristournes et demandes d’avoirs des clients, au niveau local, national et international

Informer régulièrement les KAM sur l’état des dépenses chez ses clients

Maintenir et développer différents tableaux de bord (sous Excel) avec des données en provenance de SAP par extraction sous BW / BI / BO.

Déclarer chaque mois les Chiffres d’Affaires aux clients et assurer des contacts directs avec ceux-ci si nécessaire.

Garantir le traitement de chaque demande particulière des clients en proposant des solutions préalablement validées avec son N+1

Accompagner son N+1 dans le développement de nouvelles solutions destinées à répondre à des besoins identifiés

Qui vous êtes ?

Formation de niveau Bac +3/4 minimum (Comptabilité/finance) ou disposant d’une solide expérience dans un emploi similaire de type gestion budgétaire , de préférence dans l’univers FMCG.

Vous maitrisez Excel, en particulier les TCD et fonctions avancées

Idéalement vous connaissez les outils SAP, BW et/ou Bi et/ou BO

Vous avez un bon niveau d'anglais

Vous avez une appétence pour le travail collaboratif et participatif tout en sachant faire preuve d’autonomie

Ce que nous pouvons accomplir ensemble

Chez Essity, nous pensons que chaque carrière est aussi unique que la personne et permet aux collaborateurs de réaliser leur plein potentiel dans une culture engagée, animée par un objectif fort.

Culture collaborative et inclusive | Leaders responsables et engagés | Travailler avec un objectif fort et un impact durable | Apprendre et grandir dans sa carrière | Soutenir bien-être et vie professionnelle durable | Innovations qui changent la vie | Package de rémunération compétitif

Application End Date:
15 oct. 2024
Job Requisition ID:
Essity246826"
1,France,https://www.indeed.fr/rc/clk?jk=648b1ee6274e937e&bb=5iw9r44d2hGM3tYpd5ZIhAe8FMmC0qDPQ0e2GwOBU3jfslJysE4KXu4Th4sAemRKACZj-ntQQtvQpIaBMU4HWJZqBQYnKctpNUd1nNfAd8MF-GyI8OVumw%3D%3D&xkcb=SoB167M37KUJvvW9mx0fbzkdCdPP&fccid=c55f4ad42cee2cd3&vjs=3,BI+Analyst,Paris (75),Data Analyst (F/H),Compass Group,92320 Châtillon,,"Rattaché(e) au service BUSINESS EXCELLENCE & TRANSFO, le(a) data analyst sera un véritable lien entre les enjeux métiers et nos systèmes d’information.

Vous serez accompagné(e) et encadré(e) par un data analyst Senior.

Objectif principal : Améliorer les interfaces, la disponibilité et la qualité des données, avec un focus sur la productivité


Poste en CDI

A pourvoir dès que possible


Services aux restaurants et mobilité

Responsable de la mise à jour des tables liées à l’outil ANDJARO.
Refléter notre organisation dans l’outil (traitement au fil de l’eau des demandes d’admin via HUB + suivi des campagnes mensuelles de mises à jour automatiques).
Responsable des données MAP4 en adéquation avec les processus RGPD.
Maintenance et améliorations des différents cockpits.
Création de Dashboard et mise en place de KPI’s pour répondre à des demandes opérationnelles spécifiques.
Cockpit du pilotage de la performance

La construction des cockpits impliquera les responsabilités suivantes :

Collecte, traitement, exploitation et intégration des données.
Nettoyage et préparation des données pour éliminer les erreurs, les doublons et les incohérences.
Analyse des données : Production d’analyses métiers et de recommandations aux managers.
Création de rapports : La visualisation des rapports (utilisation de Power BI) est clé pour communiquer de manière claire et compréhensible et pour aider à la prise de décisions.
Autres missions

Mise en place de processus/requêtes et automatisation.
Veille technologique des nouveaux outils visant à améliorer l’analyse des données


Vous avez une forte appétence pour les outils informatiques en général et en particulier pour les outils d’analyse et de visualisation de la Data.
Vous avez le goût du challenge, vous êtes curieux(se)et souhaitez monter en compétences sur le domaine de la data
Ce poste nécessite une forte capacité d’analyse et un bon esprit de synthèse
Vous utiliserez au quotidien Excel et Power BI

&nbsp;"
