page,country,job_link,search_keyword,search_location,job_title,company_name,company_location,salary,job_description_new
11,France,https://www.indeed.fr/rc/clk?jk=cce878d76d9b30ca&bb=RPGPIJ9IvCyjwWxDS_sMPX0kqOVz8FEOelq86F-SAopoVC_3GnSp5b1_Pdlg-fzj3cB-OZUzVEwgr-WC11h9f8ZrBYhVtguOYJywTlCD1ZLA6dUah5RFLA%3D%3D&xkcb=SoAH67M37J7LmzgKV70WbzkdCdPP&fccid=6b4c0887f234b9a2&vjs=3,Data+Analyst,Paris (75),Business Analyst Customer Data 360 H/F,AIR FRANCE KLM,Roissy-en-France (95),CDI,"Air France KLM recrute :

Vous rejoignez l'équipe Customer Data en tant que Business Analyst et travaillez en méthode Agile dans un environnement international. En coordination avec toutes les parties prenantes (IT, architectes, stakeholders), vous êtes responsable de différents sujets d'innovation, de leur analyse jusqu'à leur implémentation.


Vos principales missions consistent à :

Comprendre les enjeux métiers
Analyser les demandes d'innovation, les traduire en user stories et les prioriser conformément à leur valeur
Collaborer avec les équipes informatiques pour concevoir des solutions et les mettre en ?uvre
Valider les évolutions avant la mise en production
Assurer la conduite changement, la communication et le support aux utilisateurs finaux

Ce poste offre une grande autonomie dans l'analyse et la prise de décision. Il permet de s'épanouir dans un contexte de données très diverses, avec des interlocuteurs variés.


Les grands savoir-faire de l'équipe sont :

La transformation de données brutes en informations compréhensibles, pertinentes et utilisables par un utilisateur final
L'orchestration d'un grand nombre de processus autour du client et de ses données
Le développement d'applications utilisés par l'ensemble des agents commerciaux

Sur chacun de ces points, de nombreux projets passionnants sont en cours ou restent à construire.

Air France KLM recherche :

Vous êtes curieux et avez une appétence pour les nouvelles technologies, le monde de la Data et de la relation client. Vous disposez d'un bac + 5 universitaire/écoles d'ingénieur dans de la gestion de produit digital.


Need to have :

Analyse et rigueur
Expression orale et écrite
Proactivité et autonomie
Anglais Niveau B2
Travail d'équipe

Nice to have :

Méthode Agile Safe

Eléments attractifs du poste

Transversalité des métiers couverts
Contexte international
Sujets intégrés à la stratégie d'entreprise
Autonomie dans l'analyse et la prise de décision

Télétravail possible

Alors rejoignez-nous !

Résumé :

Référence : 2024-20436

Roissy-en-France - Ile-de-France - France
CDI
2024-09-20
Informatique, Télécom. , IT
&nbsp;"
11,France,https://www.indeed.fr/rc/clk?jk=56a9127952012f39&bb=RPGPIJ9IvCyjwWxDS_sMPUBXvOBlz_sPscLE6uKKWwq7CU1VbMkLqu88ytesopQx3wmuv5E7FgCof-Ly7FByE7KndKYDo2PHza2ULIuoM4ut1Zg9ZU_LNKjaM0RXXh_j&xkcb=SoAu67M37J7LmzgKV70UbzkdCdPP&fccid=d2f97e9b98cfe888&vjs=3,Data+Analyst,Paris (75),Senior Data Analyst - Paris,Aircall,Paris (75),,"Paris
G&A – 13008 - Data /
Full Time /
Hybrid
Aircall is a place where voices are valued.

Backed by over $220 million of investment since 2015, we create technology that fuels accessible, transparent and collaborative communication to empower our base of 18,000+ customers (and growing) to make authentic, human connections.

Conversation is a cornerstone of our culture. Wherever our people find themselves in the Aircall world – Paris, New York, San Francisco, Sydney, Madrid, London, Berlin, or at home – everyone has a voice that is valued.

Whatever your background, wherever you’re from – we want you to join the conversation. Let’s talk.

About the team
Our Data team is the backbone of Aircall’s decision-making process, driving product development and business growth with cutting-edge data products, tools, and actionable insights

About the role
As a Senior Data Analyst, you will provide invaluable insights to our product and business teams, working closely with our product and engineering leaders. You'll support impactful initiatives including pricing, packaging, multi-product strategies and self-service approaches.You will collaborate cross-functionally with Engineering, Sales, Finance, Marketing, and Customer Relations to translate data needs into powerful solutions. You'll also establish best practices in analytics and mentor team members, ensuring high standards in data governance and insight generation.
Your mission @ Aircall:
Partner with product and business leaders to define the analytics roadmap and deliver key projects in customer acquisition, engagement, and retention
Provide actionable insights and compelling narratives to influence major decisions at the C-level
Build a culture of experimentation by designing and executing rigorous A/B tests to measure business impact
Work closely with data engineers to continuously improve the data stack, governance practices, and analysis quality
A little more about you:
3+ years of hands-on technical experience in a high growth environment
Proficiency in SQL and Python for deriving insights
Data-driven, structured and solution oriented with extensive experience in building rigorous experiments
Excellent interpersonal skills and the ability to explain complex data clearly to stakeholders at all levels
You have an insatiable curiosity and are biased toward action
Aircall is constantly moving forward. We’re building new roads to complete our journey, and we’re taking people with us who have the same builder mentality.

Let’s grow together: Aircall is a place for those who dare to be bold and seek responsibility, excellence, and the opportunity to push themselves to new heights.

We’re creating a place where great people trust one another and thrive together.

People flourish at Aircall and now is the time to be part of the team and the journey we’re on.

Why join us?

Key moment to join Aircall in terms of growth and opportunities
️ Our people matter, work-life balance is important at Aircall
Fast-learning environment, entrepreneurial and strong team spirit
45+ Nationalities: cosmopolite & multi-cultural mindset
Competitive salary package & benefits

DE&I Statement:
At Aircall, we believe diversity, equity and inclusion – irrespective of origins, identity, background and orientations – are core to our journey.

We pride ourselves on promoting active inclusion within our business to foster a strong sense of belonging for all. We’re working to create a place filled with diverse people who can enrich and learn from one another. We’re committed to ensuring that everyone not only has a seat at the table but is valued and respected at it by providing equal opportunities to develop and thrive.

We will constantly challenge ourselves to make sure that we live up to our ambitions around diversity, equity and inclusion, and keep this conversation open. Above all else, we understand and acknowledge that we have work to do and much to learn.

Want to know more about candidate privacy? Find our Candidate Privacy Notice here."
11,France,https://www.indeed.fr/rc/clk?jk=f43bcf87ea7bcdca&bb=RPGPIJ9IvCyjwWxDS_sMPUBXvOBlz_sP9KU4CfhJ5w7e68Lzstma24qr84uN9pdQv3vLZsMvIbx4tHq1oJvfB2BC39HdmXU5Q4JTQZm3s_N17x9PphYFgYUNVdkgWo2-&xkcb=SoCV67M37J7LmzgKV70rbzkdCdPP&fccid=1d79a4290fb70d8e&vjs=3,Data+Analyst,Paris (75),Marketing Business Analyst - (CDD 6 mois),Deliveroo,Paris (75),,"Why Deliveroo

Our mission is to transform the way you shop and eat, bringing the neighbourhood to your door by connecting consumers, restaurants, shops and riders. We are transforming the way the world eats and shops by making access to food and products more convenient and enjoyable. We give people the opportunity to buy what they want, as they want it, when and where they want it.

We are a technology-driven company at the forefront of the most rapidly expanding industry in the world. We are still a small team, making a very large impact, and looking to answer some of the most interesting questions out there. We move fast, value autonomy and ownership, and we are always looking for new ideas

-

The role

We're looking for a Marketing Business Analyst, reporting into the Head of National Marketing & Planning

In this role, you will be in charge of:

Marketing Performance & Analysis

Hand in hand with the Finance & Strategy team, lead delivery of Marketing business reviews, actively engaging with relevant parties and demonstrating an ability to apply knowledge of business levers to diagnose performance.
Regularly update marketing teams on overall business & consumer performance and key trends
Leveraging your analytical mindset and business acumen, perform comprehensive market analysis to comprehend trends, customer needs, and opportunities. This may entail conducting market research, competitive analysis, and consumer behaviour research (with support from central teams) to deliver clear and actionable insights to the Marketing team, enabling them to define and address consumer challenges effectively
Marketing governance and planning

Coordinate the marketing team governance, including weekly and monthly business reviews
Oversee the annual and quarterly marketing planning process, to take to senior stakeholders
Ensure planning process is smooth for key stakeholders, making sure all relevant parties are aware and engaged with process steps, deliverables and deadlines.
Support the proposition analysis phase, ensuring a comprehensive overview of all relevant data (across business, brand and campaign metrics) is completed to inform our proposition strategy.
Run the planning process, including regular status update meetings with the marketing team, ensuring teams are clear on the brief, and support where required.
Project management

Work as project leader on ad-hoc strategic projects relating to marketing either in the early stage or in their execution phase, coordinating local teams and working transversally with central HQ
Your profile

3-6+ years of experience, in marketing business analyst roles, ideally within high growth consumer facing/tech companies
Master's degree
Strong analytical skills, comfortable with data & financials
Strong consumer acumen
Excellent communication skills, capacity to influence and interact across different levels of the organisation
Ability to deal with ambiguity, experience working in matrixed organisations appreciated
Excellent level of English required
-

We believe a great workplace is one that represents the world we live in and how beautifully diverse it can be. That means we have no judgement when it comes to any one of the things that make you who you are - your gender, race, sexuality, religion or a secret aversion to coriander. Deliveroo France was scored 99/100 on the Gender Equality Index 2023, demonstrating our commitment to diversity and equal opportunities. All you need is a passion for food and a desire to be part of one of the fastest growing companies in an exciting space.

Please click here to view our candidate privacy policy."
11,France,https://www.indeed.fr/rc/clk?jk=85a29d308f4fa32c&bb=RPGPIJ9IvCyjwWxDS_sMPftF1Kn73SFt8sbHyN_pYIKvPnNgZlulHfzDS2siwsXm7DbVnT57bio0xOg-dWssZQayUhp2LHXx66wrPZpFfb4AgMnsJMwz5VIavbMd4wxt&xkcb=SoAh67M37J7LmzgKV70qbzkdCdPP&fccid=dd5c973b98852085&vjs=3,Data+Analyst,Paris (75),ANALYSTE DE DONNEES H/F,Groupe Agrica,Paris (75),,"Vous ne nous connaissez pas encore ?
Le Groupe AGRICA est un groupe de protection sociale dédié au monde agricole dans toutes ses dimensions. Retraite complémentaire et Assurances de Personnes (prévoyance, santé, épargne et retraite supplémentaire) : nos expertises métiers sont multiples pour protéger et accompagner nos clients tout au long de leur vie professionnelle et au-delà.
Nous rejoindre, c’est participer à la protection de plus de 270 000 entreprises en s’engageant au cœur d’un collectif de 800 collaborateurs réunis autour de valeurs de solidarité, de responsabilité et de proximité.
AGRICA est un groupe paritaire composé d’institutions représentées par des employeurs et des salariés et n’a donc pas d’actionnaires à rémunérer.
AGRICA est engagé dans une démarche RSE avec 3 axes principaux : l’investissement responsable, l’action sociale et solidaire et la lutte contre le gaspillage alimentaire.
Signataire de la Charte de la Diversité, AGRICA s’engage pour l’égalité professionnelle et toutes nos offres sont ouvertes aux personnes en situation de handicap (membre du réseau #activateurdeprogrès - emploi & handicap).
Ce que nous pouvons réaliser ensemble
Rejoignez notre équipe au sein du département Projets, Contrôle et Décisionnel en tant qu'Analyste de Données. Vous intégrerez l'unité ""Décisionnel"", chargée de produire et sécuriser les reportings de la DAP, ainsi que de contribuer à l'évolution du système décisionnel en collaboration étroite avec les utilisateurs et la DSI.

Ce que vous accomplirez ensemble :
En tant que professionnel de la business intelligence, vous êtes chargé de collecter, analyser et interpréter les données pour fournir des informations exploitables et des perspectives stratégiques à l’entreprise. Votre capacité à innover sera un atout majeur pour adapter continuellement les modèles d'utilisation des bases de données.
Vous travaillerez en étroite collaboration avec les métiers pour comprendre leurs besoins et identifier les indicateurs pertinents, en leur proposant des méthodes d'analyse et des solutions pour optimiser l'utilisation de la BI.
Vous collaborerez avec les utilisateurs pour identifier les données les plus pertinentes.
Vous concevrez et déploierez des solutions d'expérimentation et d'automatisation des reportings et tableaux de bord.
Vous élaborerez et mettrez à jour la documentation du système décisionnel.
Vous remonterez les anomalies à la DSI et suivrez leur résolution.
Vous réaliserez la recette fonctionnelle des évolutions.
Vous construirez des modèles d'analyse de données pour faciliter la prise de décision.
Vous garantirez la fiabilité des reportings, études et analyses.
En collaboration avec le contrôle interne et la conformité, vous mettrez en place des contrôles et des indicateurs dans le système décisionnel pour répondre aux exigences de qualité et réglementaires.
Vous formerez et accompagnerez les utilisateurs de l'outil décisionnel, favorisant ainsi le partage de connaissances et la diffusion de la culture des données.
Vos atouts pour ce poste :
Vous possédez un esprit d'analyse et de synthèse développé, associé à une grande méthodologie, une curiosité naturelle et d'excellentes capacités d'apprentissage. Votre pragmatisme et votre souci du détail vous permettent de répondre efficacement aux besoins métiers. Vous êtes doté d'excellentes compétences en communication écrite et orale. Vous êtes passionné par le travail sur les données et leur structuration pour en tirer des enseignements. Vous recherchez un environnement dynamique en constante évolution et êtes capable de vous adapter rapidement.
Qualifications et expériences requises :

Vous êtes titulaire d'un diplôme de niveau Bac +4/5 en Décisionnel, Data, avec une expérience significative dans le domaine de l'assurance (Santé-Prévoyance et retraite supplémentaire) ou des outils associés. Une expérience d'au moins 5 ans sur un poste similaire est requise.
Des connaissances fonctionnelles solides dans le domaine de l'assurance de personnes santé/prévoyance sont indispensables.
Vous maîtrisez les technologies et outils liés au décisionnel et à la business intelligence (SQL, Talend, SSAS, BO, etc.), avec une expérience d'au moins deux ans sur Qlik Sense.
Ce que nous vous offrons :
Chez AGRICA, nous valorisons les potentiels, l’envie d’apprendre et nous savons à quel point il est important d’accompagner nos nouveaux collaborateurs pour une intégration réussie.
Pour vous, AGRICA :
Favorise l'équilibre vie personnelle / vie professionnelle : 21 RTT par an, télétravail (2 jours/semaine), horaires flexibles, droit à la déconnexion.
Distribue des compléments de rémunération : intéressement avec abondement sur PEE et/ou PERECO, plan d’épargne retraite supplémentaire.
Offre des avantages sociaux : complémentaire santé individuelle ou familiale, CSE, restaurant d’entreprise/titre-restaurants, association sportive.
Propose un parcours professionnel évolutif : dispositifs de mobilité interne, accompagnement RH personnalisé."
11,France,https://www.indeed.fr/rc/clk?jk=fc6f290a6f389ec7&bb=RPGPIJ9IvCyjwWxDS_sMPTjld2kQKn_tcGCb7ioR2-NOYjxNDfeJKHQTVqfUz6DAhVwRmCSHD3aaZN8zhOeaUBL-B-uCTF0ywWwPHvW-mGkU8w0twjzpFlDa2RZgVyex&xkcb=SoC867M37J7LmzgKV70pbzkdCdPP&fccid=7c92378e2736a74f&vjs=3,Data+Analyst,Paris (75),Data Analyst Intern,Upflow,Paris (75),,"About Upflow
Upflow revolutionizes the way B2B businesses get paid, unlocks owed cash reserves, and empowers B2B companies to grow better.

Most modern, fast-growing companies are fully focused on sales growth and retention and struggle to maintain focus on cash collection. This leads to thousands of unpaid invoices, broken communications, outdated payment methods, and a negative customer experience. As a result, cash flow suffers, and growth is inhibited. Upflow is the modern collections hub that manages all data, analytics, communications and payments to improve cash flows.

We are a product-led organization launched in 2018 and trusted by hundreds of companies across the US and EMEA, including Lattice, Front, Iziwork, ProductBoard, and more. We're also backed by leading investors (YCombinator, 9yards, eFounders) and top business angels from N26, Square, Mercury, Uber, and Netsuite.

We're distributed across three continents and rapidly expanding. It's a perfect time to join if you're looking for an exciting personal growth opportunity and international experience.

For more information, please visit our website www.upflow.io

Your role at Upflow
Joining Upflow as a Data Analyst Intern, you will play a vital role in enhancing our data-driven decision-making processes and supporting various teams across the organization with meaningful insights. This role is perfect for a curious and motivated individual eager to dive deep into data analytics, develop critical skills, and make an impact on our business operations.

Reporting directly to our CEO Office team, mentored by our Head of Analytics, and working closely with various stakeholders, you will:

Design, implement, and maintain key BI dashboards on top of our data warehouse to empower teams with actionable insights.

Support the development of quantitative analyses to inform business and product decisions, enabling teams to measure their impact and drive accountability.

Assist in exploring Upflow-generated and external data to uncover insights, identify opportunities, and address challenges.

Collaborate with different teams to ensure data consistency and quality, promoting a strong data culture across the organization.

Perform ad-hoc data projects to support specific business functions, delivering analysis and recommendations to leadership.

Help maintain and optimize our data infrastructure, ensuring that data is accurately recorded, analyzed, and leveraged within our tech stack.

This position is based in our Paris office, close to Grands Boulevards.

Who you are
Eager to learn and highly coachable, with a proactive attitude toward acquiring new skills and applying them effectively.

Proficient with SQL, comfortable handling and processing large datasets, and skilled at identifying and addressing data inconsistencies (aggregation/window/time functions, complex joins/subqueries/CTEs, efficient and reusable views hierarchies/infrastructure)

Data and dataviz enthusiast with a strong understanding of data-driven decision-making, able to find the right balance between quantitative and qualitative insights.

Proficient in Excel/Google Sheets, including advanced functionalities such as index/match, array formulas, and sumproducts.

Organized and capable of managing multiple tasks and projects simultaneously, with a strong attention to detail.

Strong communicator, able to interface effectively with stakeholders across various levels of the organization, and explain complex data concepts in a clear and concise manner.

Empathetic and humble, focused on solving business problems with data and understanding that data is a means to an end.

Able to work autonomously and contribute effectively in a dynamic, international environment.

Fluent in English.

Why join us?
Top-notch data stack: Learn from our mature stack and best practices in the industry

SQL & Warehouse: Google BigQuery, PostgreSQL

BI: Periscope, Mixpanel

Data Infrastructure: DBT, Google, Github, Fivetran, Stitch, Python

Defined pathway: This is a structured 6-month internship designed to immerse you deeply in the workings of Upflow’s data operations.

Growth prospects: Upon successful completion of the internship, and subject to mutual satisfaction, there will be opportunities to transition into a permanent role within the business, allowing you to further develop your career and contribute to Upflow’s success.

International mindset: We have offices in Paris and New York.

Flexible working: On-site job in Paris in a hybrid office culture.

All-star team: Excellent team with deep functional and domain expertise.

Learning opportunity: Strong focus on learning and growing through education and professional development in hard and soft skills.

Trusting environment: Hands-off management style. We have a strong culture of ownership and autonomy.

Best in-class perks: Meal vouchers, cool offices, top-of-the-range equipment

Offsites: Regular offsites with the team, meetups, and strong connections to the startup ecosystem

This is a paid internship, compensated 1,500 EUR per month.

Recruitment process
1 - Screening call with Francesca, our Admin & People Manager

Francesca will take a first call with you to discuss what you enjoy and what you’re looking for in applying to this internship. Come with questions, we’d love to help you see yourself working at Upflow!

2 - Technical home assignment

Your time to shine! You’ll be given a technical home assignment on SQL. Yes, it is designed to assess your skills, but it’s also designed to give you a better taste of what being part of Upflow is like. Again, hiring is a two-way street! Ultimately: we believe assignments are a great way to control our biases. We care for what you do; not your schooling, social background, or the gender you identify yourself to.

3 - Home assignment review & Team interview

Alexandre (Finance Director, and your future manager) and someone from our Product team (your future technical mentor) will debrief your case with you. Hiring managers at Upflow are looking for team players: taking and giving feedback is key to thriving with us!

4 - Founder interview

Meet with Alex, our co-founder & CEO. He will tell you everything about Upflow’s vision and values. It’s a privileged moment to ask questions, too."
