page,country,job_link,search_keyword,search_location,job_title,company_name,company_location,salary,job_description_new
2,France,https://www.indeed.fr/rc/clk?jk=a236db8e8f4c3bfb&bb=sGZGH4wWv34hsIzldBUKeGD7zvIqyRrRsgitp_qyOomYODuK58iyoi71oCyFEYaoNnVQXtc6nlonu0gqmpc-wn38MBuPKV1kDRz9yG1r6PBlrbZ6hBbEpbt7D8CcX7hc&xkcb=SoBj67M37KUSyORqw50JbzkdCdPP&fccid=2dd5571bf77513ca&vjs=3,BI+Analyst,Paris (75),Data Analyst SupplyChain,STEP UP,Télétravail partiel à 91300 Massy,,"A propos
STEP UP est une société d'ingénierie experte en pilotage de projets industriels et informatiques (+ 230 collaborateurs sur 9 agences en France), plaçant le potentiel humain comme 1er vecteur d'excellence et de performance en entreprise.
Oubliez les sociétés d'ingénierie qui ne valorisent que vos seules compétences, chez STEP UP, nous visons également l'adéquation entre votre personnalité et la culture d'entreprise de nos clients. Cela se traduit pour vous par une différence fondamentale en termes de bien être, d'épanouissement au travail et de succès dans vos missions.

Ce que vous nous proposons :
Un cadre de travail épanouissant, stimulant et collaboratif, nous sommes certifiés entreprise où il fait bon vivre !
Des projets innovants et variés.
La possibilité de se perfectionner continuellement avec des formations internes.
Des perspectives d'évolution de carrière.
Un accompagnement individualisé avec un programme de développement du potentiel humain.
Un programme de cooptation.
Et bien sûr, nous prenons en charge 60% de votre mutuelle santé et encourageons financièrement la mobilité douce.

Le poste
Data Analyst – Expert Supply Chain

Lieu: MASSY

Contrat: CDI

Expérience: Minimum 2 ans en Data Analyse dans un environnement Supply Chain

Secteur: Analyse de données & Supply Chain


À propos du poste :
Rejoignez une organisation industrielle de premier plan, où vous jouerez un rôle clé dans l'optimisation des processus de Supply Chain grâce à vos compétences en Data Analyse. Votre mission principale sera d'identifier, analyser, et interpréter les données provenant de différentes sources, afin de résoudre des problématiques complexes de la chaîne d'approvisionnement. Votre capacité à traduire les données en opportunités d'amélioration sera cruciale pour optimiser les performances opérationnelles.

Vos missions :
Analyse de la Supply Chain : Comprendre les enjeux spécifiques, collecter et nettoyer les données.

Techniques d'analyse : Appliquer des analyses descriptives, prédictives et de tendance pour identifier les causes profondes des problèmes.

Visualisation et reporting : Créer des graphiques dynamiques et des tableaux de bord interactifs pour aider à la prise de décision.

Solutions d'amélioration : Proposer des recommandations et suivre l'impact des actions mises en place.


Profil recherché

Compétences requises :
Outils d'analyse : Maîtrise de Power BI, SQL, Python et R.

Expérience en Supply Chain : Expérience dans un environnement ERP (notamment SAP), avec une bonne compréhension des flux logistiques.

Communication : Aisance relationnelle, capacité de vulgarisation des résultats analytiques.

Rigueur et méthode : Capacité à livrer des résultats précis et mesurables.

Livrables attendus :
Rapports d'avancement hebdomadaires

Visualisations (tableaux de bord, graphiques)

Rapports d'analyse détaillés (descriptifs, prédictifs)

Présentations de suivi et documentation utilisateur

Vous souhaitez relever ce défi et apporter une réelle valeur ajoutée dans un environnement stimulant et dynamique ? Postulez maintenant et rejoignez une équipe de passionnés de la Data Science !

#DataAnalyst #SupplyChain #AnalyseDeDonnées #DataVisualization #Python #SQL #ERP
"
2,France,https://www.indeed.fr/rc/clk?jk=30a717055cfaba96&bb=sGZGH4wWv34hsIzldBUKeGGknVY8pz9z2V2NTjKt0L8zyTT3ns7Tr67MhZ-2gLPojc0XrdzpH9mdZfdtlXFpF_bfYHrczLUH8-D3dYhH2iqqiAOecay-2tZEJk1cC2j6&xkcb=SoDX67M37KUSyORqw50IbzkdCdPP&fccid=1d27cf476b023929&vjs=3,BI+Analyst,Paris (75),Data Analyste (Tableau Software) (h/f),Skillspark AB,Paris (75),,"Start
ASAP
Duration
> 12 months

emagine recherche une(e) Data Analyste (Tableau Software)

pour l'un de ses clients finaux

Lieu : Ile de France ( 93000 )

Durée : 3 ans et plus

2,5 jours de télétravail par semaine

Contexte :

Au sein de l’équipe Data as a Service du domaine Data Exposition, vous assurez un accompagnement sur les différentes phases du traitement des demandes, et vous représentez le métier auprès des équipes techniques.

Activités de cadrage et de conception

La qualification des demandes et la priorisation des activités de l’équipe responsable de la mise en place des services.

Mission :

Collecter les besoins et les attentes des demandes exprimés par le métier
Assurer la première analyse et accompagner le métier dans la qualification des demandes
Vérifier la complétude, la pertinence des demandes et les valider
Proposer un planning, mener la phase de cadrage et suivre la phase de réalisation
Animer des ateliers de travail avec les différentes équipes contributrices
Assurer la communication avec le métier et l’interface avec les équipes techniques
Participer dans l'évolution du catalogue de services DATA
Être force de proposition dans l'amélioration continue des services fournis à nos clients

Technologies demandées :

Tableau Software, Langages : SQL, PL/SQL et Anglais technique

Optionnelles :

Connaissances en matière de Data Bases de données : Oracle, SQL Server, PostgreSQL JIRA, Confluence Outils de Data Visualisation : Power BI

Profil :

Expérimenté( 3 ans minimum )

Si cette mission vous correspond et vous intéresse, merci de m’envoyer votre cv : Sumi.Delplanque@emagine.fr


Sumi Delplanque
Delivery Specialist

Sumi.Delplanque@emagine.org
+33 1 41 92 56 78"
2,France,https://www.indeed.fr/rc/clk?jk=df07098f4d5ea001&bb=sGZGH4wWv34hsIzldBUKeOz8MSRRr_qXmRwJ2jdhSca_hwhu_1N3rZFvg1plpgZ0l6NVw_tKFW06IWgzBcaSKO427r6eRaXd-FSqqrke9pB5ooWyOzjYXA%3D%3D&xkcb=SoBZ67M37KUSyORqw50PbzkdCdPP&fccid=602253e702c29e48&vjs=3,BI+Analyst,Paris (75),Business Analyst / Data Scientist,I.C.C,Paris (75),,"? La mission :
Nous recherchons un(e) Business Analyst / Data Scientist expert(e) en Blue Prism Process Intelligence (BPPI), avec une solide expérience en Machine Learning (ML), Deep Learning (DL), NLP et Large Language Models (LLM). Vous participerez à nos projets de Process Mining et Intelligent Robotic Process Automation (RPA), en collaborant avec nos équipes pour améliorer et optimiser nos processus métiers.

? Vous serez force de proposition sur les meilleures pratiques, et vous contribuerez activement à l?implémentation des solutions d?IA pour identifier les goulets d?étranglement et les opportunités d?optimisation.

? Vos responsabilités :
Analyse des données métiers pour identifier les inefficacités et proposer des optimisations.
Paramétrage et configuration de la solution BPPI.
Implémentation de modèles d?IA (ML, DL, LLM) avec des outils comme pandas, NumPy, scikit-learn, TensorFlow.
Production de dashboards et visualisation des résultats avec Power BI.
Documentation des interventions et support technique.
Requêtage avancé avec SQL et Python.

? Compétences recherchées :
Expertise en Blue Prism Process Intelligence (BPPI).
Maîtrise des outils de transformation de données (ETL, SQL, Python, Power BI).
Solides compétences en implémentation de modèles d?IA et d?IA générative.
Bonne connaissance des environnements de données (JSON/XML, bases relationnelles/NoSQL).
Expérience en Process Mining et RPA (un plus).

? Livrables attendus :
Transformation des données et paramétrage des solutions BPPI.
Visualisation des résultats d?analyse et développement de tableaux de bord.
Documentation complète et rapports de suivi.



Profil candidat:
Nous recherchons un(e) Business Analyst / Data Scientist expert(e) en Blue Prism Process Intelligence (BPPI), avec une solide expérience en Machine Learning (ML), Deep Learning (DL), NLP et Large Language Models (LLM). Vous participerez à nos projets de Process Mining et Intelligent Robotic Process Automation (RPA), en collaborant avec nos équipes pour améliorer et optimiser nos processus métiers."
2,France,https://www.indeed.fr/rc/clk?jk=deaa67e667453519&bb=sGZGH4wWv34hsIzldBUKeN4XtbTItg6EFW_URwcC3lnsN4m2L7dVIhV9myTAv0xQXtiFeXq9TvB-qRzJPyOKSqIRwMxBCVwQDQKIDl7lyPxzMpcYqzId7Ojp_AYHYWHM&xkcb=SoDt67M37KUSyORqw50ObzkdCdPP&fccid=fb01cd4367979248&vjs=3,BI+Analyst,Paris (75),Data Analyste pour Ubigi H/F,Transatel,Télétravail partiel à 92800 Puteaux,,"Transatel est un fournisseur mondial de solutions de connectivité cellulaire et le 1er agrégateur d’opérateurs mobiles alternatifs MVNO en Europe. Et si vous connectiez le monde, au-delà des frontières ?


Votre mission


Vous rejoindrez l’équipe Ubigi, l'une des business units stratégiques de Transatel. Ubigi offre au grand public et aux entreprises un accès immédiat à Internet avec une large gamme de forfaits de données mobiles économiques, disponibles pour smartphones, tablettes, ordinateurs portables et véhicules connectés, dans plus de 200 destinations. La business unit regroupe 5 équipes : marketing, design, web, commerciales et support clients.

Ce recrutement intervient dans un contexte de croissance soutenue des résultats commerciaux de Ubigi. Nous souhaitons mieux maîtriser l’analyse de nos bases clients afin d’optimiser nos coûts et augmenter nos revenus.


En tant que Business Analyst, vous jouerez un rôle central dans l’analyse des performances d’Ubigi. Vos principales missions incluront :

Analyser les données clients pour identifier les comportements d’achat et les opportunités d’optimisation.
Suivre et évaluer les KPI afin de mesurer les performances des offres Ubigi et proposer des améliorations.
Collaborer avec les équipes commerciales et marketing pour affiner les stratégies de segmentation et d’acquisition de clients.
Fournir des analyses approfondies pour optimiser la rentabilité de nos offres de données mobiles.
À terme, vous pourriez évoluer vers des fonctions stratégiques ou de gestion de projet, en fonction de vos résultats et compétences.


Votre profil

Vous êtes diplômé en économie, finance, statistiques ou dans un domaine équivalent (niveau Bac+5) et avez 2 à 5 ans d’expérience dans un rôle de business analyst ou dans une fonction similaire. Vous maîtrisez :

La manipulation et l’interprétation de grandes bases de données à l’aide d’outils tels qu’Excel, SQL ou Power BI.
La capacité à travailler en étroite collaboration avec plusieurs équipes pour mener à bien vos analyses.
L’anglais courant est indispensable dans un environnement fortement international.
Les conditions de réussite

Votre curiosité vous permet de comprendre rapidement les spécificités des marchés des télécommunications et de la connectivité.
Vous avez un esprit analytique solide et êtes orienté vers la résolution de problèmes.
Vous êtes motivé par l’innovation et l’optimisation des performances financières.
Vous aimez travailler en anglais dans un environnement international.

Notre process de recrutement

Chez Transatel, nous nous efforçons d’avoir un process global efficace afin de finaliser nos recrutements dans les meilleurs délais (environ 3 semaines).

Voici les différentes étapes du processus de recrutement :

Première prise de contact RH par téléphone
Entretiens : Un entretien Manager / RH + un ou plusieurs entretien(s) opérationnel(s) ou technique(s)
Un test de personnalité en ligne
Un appel RH vous présentant l’offre de collaboration en détails puis réception de celle-ci par mail
Accueil & parcours d’intégration
Nos avantages

Package salarial : fixe + bonus individuel + intéressement semestriel et participation (plaçables sur PEE ou PER)
Comités de salaire tous les 6 mois
Jusqu’à 2 jours de télétravail, 25 jours de congés + des jours offerts
CSE, restaurant d’entreprise dans les locaux, mutuelle avantageuse, remboursement navigo à 50% ou forfait mobilité durable
Pour plus d’information, se référer à la page carrière de Transatel : https://www.transatel.com/fr/nous-rejoindre/remuneration-et-avantages/

Si vous êtes arrivés jusqu’en bas de cette offre, il serait dommage de remettre votre candidature à plus tard, postulez !"
2,France,https://www.indeed.fr/rc/clk?jk=170951741428ce59&bb=sGZGH4wWv34hsIzldBUKeGGknVY8pz9zf_nFan-_d0RybxPAbgko-SwFNxVQuy-3UgIjOsIx290_smMFo53-4Mru13LFGYBP6wQxVBTj93ktD8YBZMoS1ml-hMEVR0pv&xkcb=SoBw67M37KUSyORqw50NbzkdCdPP&fccid=957adda4f0686a50&cmp=Lucky-Cart&ti=Business+Analyst&vjs=3,BI+Analyst,Paris (75),Business Data Analyst,Lucky Cart,75002 Paris 2e,,"Descriptif du poste

La forte croissance que nous enregistrons et les projets de développement à l’international nous amènent à renforcer notre équipe Business Insight en recrutant un Business Data Analyst (H/F).

Rattaché(e) au Lead Business Insight, Vous devrez fournir des analyses chiffrées et des data visualisations, avec une vue stratégique et complémentaire de notre outil de BI opérationnel (bilans de performances de nos campagnes), en exploitant les bases de données de nos clients distributeurs et industriels.

Votre leadership, votre ambition et votre engagement feront de vous une partie intégrante de la forte expansion de Lucky Cart en France et en Europe.

Au cœur de la société, vous collaborerez au quotidien avec toutes les équipes impliquées (marketing, R&D, data et juridique) pour mener à bien vos missions.

MISSIONS

Sous la responsabilité du Lead Business Insight, vous aurez pour missions :

Faciliter la compréhension du business de Lucky cart à travers les données internes en proposant des sujets d’analyse, des mesures ou des solutions permettant d’améliorer la connaissance de nos solutions ou plus largement du marché du Drive alimentaire en France.
Transcrire de façon précise et compréhensible les demandes business (Sales, Marketing, Communication) en KPI afin de mettre en place des requêtes SQL ou scripts Javascript ou Python.
Mettre en place des KPI pertinents pour monitorer et évaluer l’activité de Lucky cart et de ses solutions en fonction des besoins en utilisant les connaissances business et techniques.
Améliorer les outils existants mis en place en interne et proposer de nouveaux outils pour fluidifier le travail de l’équipe Business Insight sur tous les plans (mise à disposition des données, datavisualisation, génération des bilans, transmission de l’information entre les équipes).
Analyser les bilans de nos campagnes ou les résultats des études basées sur nos bases de données afin de communiquer une information claire, illustrée si besoin, exploitable et opérationnelle.
Être force de proposition et prendre le lead sur des dispositifs innovants,
Travailler en parfaite collaboration avec les autres fonctions au sein de la société (marketing, R&D, Sales, Produit),
Assurer un reporting régulier de l’activité.
Profil recherché

COMPÉTENCES

Savoir faire des requêtes SQL
Savoir manipuler des grands volumes de données sous Big Query
Avoir une sensibilité business et être conscient des besoins/des contraintes pour comprendre et cadrer les demandes des équipes Sales, Marketing, Communication.
Être curieux, autonome, rigoureux pour aller chercher l’information directement dans les bases Big Data de Lucky Cart.
Avoir l’esprit d’analyse et critique pour étudier les résultats en lien avec l’objectif et le contexte du travail.
Savoir communiquer des résultats à l’écrit et à l’oral de manière synthétique ou détaillée pour présenter les demandes et les études aux différentes équipes de Lucky Cart.
Chercher constamment à élargir et approfondir ses connaissances notamment dans des domaines connexes à la data science, le e-commerce et la distribution,
Partager les connaissances et compétences acquises avec les membres de l’équipe par des canaux officiels et informels,
Démontrer la capacité à collaborer avec des personnes d’autres disciplines.
Autonomie, organisation, bonne communication.
COMPÉTENCES SOUHAITABLES

Avoir des connaissances de l’environnement Google (Looker, BigQuery)
Avoir des connaissances de Python
Avoir des connaissances de la grande distribution
Avoir des connaissances de solutions SQL ou de datavizualisation
PROFILS

Bac +5,
École d’ingénieur ou grande école d’informatique, Phd (CIFRE) ou Master Recherche,
Anglais courant,
OBLIGATOIRE: 5 ans d’expérience mini en tant que Data Analyst
Déroulement des entretiens

Entretien #1: Chief Marketing & Strategy + RH

Entretien #2: & Use Case: Data Engineer + 1 autre membre de l’équipe

Entretien #3: Lead Business Insight + 1 autre membre de l’équipe

Type d'emploi : Temps plein, CDI
Statut : Cadre

Rémunération : 38 452,41€ à 50 000,00€ par an

Avantages :

Prise en charge du transport quotidien
Travail à domicile occasionnel
Horaires :

Du lundi au vendredi
Repos le week-end
Travail en journée
Rémunération supplémentaire :

Primes
Lieu du poste : En présentiel
"
2,France,https://www.indeed.fr/rc/clk?jk=648b1ee6274e937e&bb=sGZGH4wWv34hsIzldBUKeN4XtbTItg6Eb6Zvm00VGm_ln_g9grz0HoFAqKr6vsVVlvXO2giS48yCOSq6Y94lDgkV3vIEZzeGBe9S72Jg3_-uoVHTCZrEhA%3D%3D&xkcb=SoDE67M37KUSyORqw50MbzkdCdPP&fccid=c55f4ad42cee2cd3&vjs=3,BI+Analyst,Paris (75),Data Analyst (F/H),Compass Group,92320 Châtillon,,"Rattaché(e) au service BUSINESS EXCELLENCE & TRANSFO, le(a) data analyst sera un véritable lien entre les enjeux métiers et nos systèmes d’information.

Vous serez accompagné(e) et encadré(e) par un data analyst Senior.

Objectif principal : Améliorer les interfaces, la disponibilité et la qualité des données, avec un focus sur la productivité


Poste en CDI

A pourvoir dès que possible


Services aux restaurants et mobilité

Responsable de la mise à jour des tables liées à l’outil ANDJARO.
Refléter notre organisation dans l’outil (traitement au fil de l’eau des demandes d’admin via HUB + suivi des campagnes mensuelles de mises à jour automatiques).
Responsable des données MAP4 en adéquation avec les processus RGPD.
Maintenance et améliorations des différents cockpits.
Création de Dashboard et mise en place de KPI’s pour répondre à des demandes opérationnelles spécifiques.
Cockpit du pilotage de la performance

La construction des cockpits impliquera les responsabilités suivantes :

Collecte, traitement, exploitation et intégration des données.
Nettoyage et préparation des données pour éliminer les erreurs, les doublons et les incohérences.
Analyse des données : Production d’analyses métiers et de recommandations aux managers.
Création de rapports : La visualisation des rapports (utilisation de Power BI) est clé pour communiquer de manière claire et compréhensible et pour aider à la prise de décisions.
Autres missions

Mise en place de processus/requêtes et automatisation.
Veille technologique des nouveaux outils visant à améliorer l’analyse des données


Vous avez une forte appétence pour les outils informatiques en général et en particulier pour les outils d’analyse et de visualisation de la Data.
Vous avez le goût du challenge, vous êtes curieux(se)et souhaitez monter en compétences sur le domaine de la data
Ce poste nécessite une forte capacité d’analyse et un bon esprit de synthèse
Vous utiliserez au quotidien Excel et Power BI

&nbsp;"
2,France,https://www.indeed.fr/rc/clk?jk=fd64421c261c1fa8&bb=sGZGH4wWv34hsIzldBUKeAcQKS-80JLoUXFrc_I3DxVvmhpKYUmcsMpkdQLee33iixE34suFwstAb5Z5lCQ_YBlLPIjTLpFc2b8tC7foaRjHqkfVQucSqA%3D%3D&xkcb=SoAt67M37KUSyORqw50DbzkdCdPP&fccid=df6948c9b8da6236&vjs=3,BI+Analyst,Paris (75),Data-Analyst Audit- H/F/X,Société Générale,La Défense (92),,"Vos missions au quotidien
Vous savez « faire parler » les données pour créer de la valeur ? Vous souhaitez travailler en mode agile ? Rejoignez-nous !

Sous la direction d’un Responsable, et en tant que Data Analyst, vous participerez à des missions d’audit portant sur l’ensemble des activités de la Banque de Détail et de la Banque Privée Société Générale en France, de l’Assurance et de Boursobank, où vous aurez la charge de réaliser des extractions, des analyses de données et de participer à des projets transversaux.

Votre mission consistera à accompagner les missions d’Audit :

Explorer, requêter et analyser les données liées aux diverses demandes d’extraction et d’analyse data pour les missions d’audit (enrichissement de fichiers existants et/ou extractions ad-hoc)
Exploiter les données dans le respect de leur sensibilité et du cycle de vie défini et en conformité avec les règles de sécurité de l’information et de compliance
Déceler les potentiels axe d’industrialisation : création de pipelines d’automatisation des tâches des auditeurs et création d’outils à destination des équipes d’audit pour la déclinaison d’approches à forte valeur ajoutée
Se positionner en partenaire de confiance des missions d’Audit, comprendre ses besoins métiers puis les traduire en termes de connaissance des données
Identifier les données requises, garantir l’adéquation de celles-ci avec les besoins métier des auditeurs et assurer la liaison avec le(s) propriétaire(s) de ces données
Réaliser une veille technologique sur le domaine de la donnée
Et si c’était vous ?
Vous préparez un Bac +4/5 en école d'Ingénieurs ou Université avec une spécialisation en Informatique/Data
Vous avez des connaissances en SQL, Python, base de données. La connaissance d’un outil de Business Intelligence (Power BI) est un plus
Vous êtes à l’aise avec des thématiques de data-engineering / data-analytics et les différentes techniques d’exploitation de données
Vous démontrez des capacités d’analyse et de synthèse
Vous êtes reconnu pour votre qualité relationnelle et vous avez le goût du travail en équipe
Vous disposez de qualités rédactionnelles et organisationnelles avérées
You're fluent in english ! Vous êtes notre candidat idéal !
Pensez à accompagner votre CV de votre planning de formation !

Plus qu’un poste, un tremplin
Dès votre arrivée, vous serez intégré dans nos équipes et apprendrez chaque jour aux côtés de nos experts qui vous accompagneront dans vos missions. Progressivement, vous gagnerez en autonomie sur vos projets pour faire de cette expérience un vrai accélérateur de carrière. Vous découvrirez également toute la diversité de nos métiers, dans un secteur qui évolue et innove en permanence.

A la fin de vos études ou de votre VIE, diverses opportunités pourront s’offrir à vous, en France et à l’international.

Pourquoi nous choisir ?
Attentif à votre qualité de vie et conditions de travail, vous bénéficiez d’avantages :

Jours de télétravail (pour tout stage de longue durée et selon le rythme de votre service)
Prise en charge de 50% de votre titre de transport
Billetterie à prix réduits de notre Comité d’Entreprise (concerts, cinéma, sport…)
Offre variée de restaurants d’entreprise et de cafétérias à tarifs compétitifs ainsi que des titres restaurants dématérialisés quand vous êtes en télétravail
Créer, oser, innover, entreprendre font partie de notre ADN. Si vous aussi vous souhaitez être dans l’action, évoluer dans un environnement stimulant et bienveillant, vous sentir utile au quotidien et développer ou renforcer votre expertise, nous sommes faits pour nous rencontrer !

Vous hésitez encore ?

Sachez que nos collaborateurs peuvent s’engager quelques jours par an pour des actions de solidarité sur leur temps de travail : parrainer des personnes en difficulté dans leur orientation ou leur insertion professionnelle, participer à l’éducation financière de jeunes en apprentissage ou encore partager leurs compétences avec une association. Les formats d’engagement sont multiples.

Nous sommes un employeur garantissant l'égalité des chances et nous sommes fiers de faire de la diversité une force pour notre entreprise. Le groupe s’engage à reconnaître et à promouvoir tous les talents, quels que soient leurs croyances, âge, handicap, parentalité, origine ethnique, nationalité, identité de genre, orientation sexuelle, appartenance à une organisation politique, religieuse, syndicale ou à une minorité, ou toute autre caractéristique qui pourrait faire l’objet d’une discrimination.

Référence: 24000LRZ
Entité: Fonctions centrales groupes
Date de début: 09/11/2024
Date de publication: 09/09/2024
&nbsp;"
