page,country,job_link,search_keyword,search_location,job_title,company_name,company_location,salary,job_description_new
12,France,https://www.indeed.fr/rc/clk?jk=945176506e209692&bb=vo8bM3VJ_e5-ZWMcwV_OvR5XArQF32eOXvIZZQYNrSFLEG_OFYxVYY6McrbYUBZWisRp-9ZCV2mD9JkEaH-Br9lAnaJuBY4wutIZhZN9A91zYvNxDuk6jmC7kM5dQaxV&xkcb=SoBK67M37J7TEFxqw50KbzkdCdPP&fccid=c8db58d2313bfb79&vjs=3,Data+Analyst,Paris (75),Data Analyst,Acolad,Boulogne-Billancourt (92),,"Boulogne-Billancourt, Île-de-France, France
Global Marketing & Pre-Sales
Full-time

Description:
Acolad is the global leader in content and language solutions. Its mission is to support companies in every industry to scale across markets and enable growth through cutting-edge technology and localization expertise. Established in 1993, the group is present in 23 countries across Europe, North America, and Asia, with over 1.800 employees supported by a network of +20.000 linguists around the world.

At Acolad, every position is key to our global growth: we know that we will only succeed if our people succeed.

Joining Acolad means a unique opportunity for professional development through a collaborative global environment that promotes talent and creativity. We are continuously looking for new talent (like you!) to support our mission to drive growth and innovation across some of the world’s leading brands.

We are seeking a motivated and detail-oriented Entry-Level Data Analyst to join our team. The ideal candidate will be passionate about data, possess strong analytical skills, and be eager to solve complex problems. As a Data Analyst, you will work closely with business partners across various departments to support data-driven decision-making. This role offers a great opportunity to work on a wide range of subjects, always in a hands-on capacity.

Key Responsibilities:

Analyze data provided by data engineers to support business operations and decision-making.
Develop and maintain reports using Tableau and manage them in Tableau Cloud to provide insights to business partners.
Write complex SQL queries to extract and manipulate data from databases.
Utilize Python for data analysis and/or automation.
Collaborate with cross-functional teams to understand their data needs and provide actionable insights.
Present findings and recommendations to stakeholders in a clear and concise manner.
Continuously seek to improve processes and data quality.
Stay curious and proactive in identifying new opportunities and challenges within the data.
Requirements:
Master’s degree in Data Science, Analytics, Computer Science, or a related data-focused field.
Fluency in English is required.
Proficiency in SQL for data extraction and manipulation.
Experience with Tableau (or equivalent) for data visualization and management in Tableau Cloud (or equivalent).
Strong knowledge of Python for data analysis and scripting.
Excellent analytical and problem-solving skills.
Strong attention to detail and a commitment to data accuracy.
Effective communication skills, with the ability to explain complex concepts to non-technical stakeholders.
Curiosity and eagerness to tackle new challenges.
Preferred Qualifications:

Internship or academic project experience in data analysis or a related field is a plus.
Knowledge of data warehousing concepts and tools is advantageous.
Experience working with large datasets is a plus.
Benefits:
Competitive salary and performance-based bonuses
Work in an international and multi-cultural environment
Up to 2 days remote per week
Acolad is committed to creating a diverse and equitable workforce. We believe that diversity, equity, and inclusion in all its forms - gender, age, disability, marital status, ethnic or social origin, religion, belief, or sexual orientation - enrich the workplace. It opens opportunities for individuals to express their talents, both individually and collectively, and strengthens our ability to adapt to a changing world. As an equal opportunity employer, we welcome and consider applications from all qualified candidates, regardless of their backgrounds.

&nbsp;"
12,France,https://www.indeed.fr/rc/clk?jk=ec6e6751ae6ef00d&bb=vo8bM3VJ_e5-ZWMcwV_Ovbk0niF3SOAIkiHJfukSMFArEjIY_MA3AJ5yCq0Adks8QugZvBUBiZjxTVultatyNfzhkMCMGnfmbfGRPkmWMrvDP_Io9Wuxn9VtgPjlMZxx&xkcb=SoDX67M37J7TEFxqw50JbzkdCdPP&fccid=d87a03e3623e180d&vjs=3,Data+Analyst,Paris (75),Data analyst junior H/F - Apprentissage Bac+4/5,Renault Group,Noisy-le-Grand (93),,"Société
DIAC SA
Descriptif du poste
En route vers Mobilize !
A l’écoute de tous nos clients, nous créons des services financiers innovants pour construire une mobilité durable pour tous.
Rejoindre Mobilize Financial Services, c’est d’abord choisir d’intégrer un groupe international, filiale de Renault Group, une banque de financement solide, partenaire du constructeur Renault et d’autres marques du secteur automobile. Nos 4 000 collaborateurs présents dans 35 pays, agissent ensemble au service de nos clients.
Nous proposons à nos clients - particuliers comme professionnels - les financements et les services les plus adaptés pour les véhicules neufs et d'occasion.
Mobilize Financial Services a financé plus de 1,2 million de dossiers (véhicules neufs et véhicules d’occasion) en 2023 et vendu 3,9 millions de services
Notre entreprise se ""MOBILIZE"" en faveur de la diversité culturelle, l'égalité hommes-femmes et l'intégration de personnes en situation de Handicap, au travers notamment de notre Chartre. Nous favorisons un environnement de travail où les différences individuelles sont reconnues, appréciées, respectées et valorisées, de façon à mettre à profit les talents et les forces de chacun.
En 2023, 124 alternants ont intégré notre Groupe ; cet indicateur démontre la volonté de nos équipes à vous accompagner dans votre formation et à participer à votre réussite professionnelle.
Prenez le volant ! Pas de routine, tous nos itinéraires sont différents !
Le département Performances commerciales France de la Direction des Ventes :
Met en place les reportings commerciaux (Volume, Chiffre d’affaires, Taux d’intervention, Rémunération) pour suivre la performance et animer les réseaux ;
A en charge la rémunération des réseaux Renault et Nissan sur les financements et services ;
Participer à la mise en place de certains projets internes à la Direction Régionale, partagés avec les autres directions régionales Renault, Dacia, Sodicam² ou avec les services supports du siège de MFS.
Vos missions consisteront à :
créer des rapports SAP Business Object (BI4) en fonction des besoins métiers et des différents projets suivis par le département ;
Elaborer des requêtes SQL pour vérifier les données datawarehouse ;
Lancer des traitement sSAS pour générer des datamarts ;
Aider à la définition des besoins pour la mise en place d’alimentation datawarehouse par les équipes SI ;
Participer à la validation fonctionnelle ;
Accompagner les directions régionales : compréhension de la performance régionale, mise en ligne de suivis d'animation, amélioration des processus ;
Réaliser des études sur l’évolution de la performance du réseau sur les différents indicateurs (indicateurs internes, CA, Rémunération…) ;
Contribuer à la documentation des process interne du département ;
Mettre en place de nouveaux outils au sein du service et/ou de la direction (Spotfire, Alteryx et outils internes).
Véritable tout-terrain, vous nous intéressez !
Vous préparez un BAC+4/+5 en informatique ou en data mining ou en business/data analyst
Vous faites preuve de rigueur, de précision, d’un esprit d’équipe
Vous avez une aptitude à travailler en transversal
Vous êtes motivé(e)
Vous avez une bonne maîtrise des outils informatiques (Excel, Business Object).
Le maîtrise d’Excel pour intégrer des fichiers externes dans les chaines de traitements des données est un atout
Vous avec des connaissances e langages SAS, SQL
Durée du contrat : 12 à 24 mois
Pourquoi nous rejoindre ? Votre Pack confort est composé de nombreux avantages :

Un environnement de travail moderne et convivial : locaux agréables, un CSE dynamique avec de nombreuses (offres voyages, sport, famille) et selon les sites,
salle de sport, restaurant d’entreprise ou tickets restaurant, ainsi qu’un parking
Nous sommes mobilisés pour développer la qualité de vie au travail de nos collaborateurs en faisant évoluer nos façons de travailler (méthodes, outils, organisation du travail…) et nous sommes fiers d’être certifiés en 2023 Great Place To Work
Possibilité de télétravailler occasionnellement
A l’issue de l’alternance, possibilités d’embauche en fonction des opportunités de recrutement en CDI/CDD.
Nous proposons une rémunération basée sur le salaire minimum conventionnel (de 518€ à 2 094€ brut) et selon le profil + Participation + Intéressement
Remboursement à hauteur de 75% des frais d’abonnement aux transports public ou forfait de transport mensuel selon le mode de locomotion
Nos locaux sont situés à Noisy-Le-Grand.
Pour en savoir plus sur notre entreprise, suivez-nous sur
LinkedIn
!
La route du recrutement ?
Si votre candidature est retenue, vous serez contacté(e), pour un entretien avec l’opérationnel.
Puis, si votre profil correspond à nos besoins, vous serez contacté(e) par la fonction RH
L’équipe Mobilize FS a hâte de vous recevoir !
Métier
Transverse
Durée du contrat
Renault Group s’engage à créer un environnement de travail inclusif et les conditions permettant à chacun de nous d’apporter sa passion, donner le meilleur de lui-même et s’épanouir, tout en étant lui-même.

Nous trouvons notre force dans notre diversité et nous nous engageons à garantir l'égalité des chances en matière d'emploi, indépendamment de la couleur, de l'ascendance, de la religion, du sexe, de l'origine nationale, de l'orientation sexuelle, de l'âge, de la citoyenneté, de l'état civil, du handicap, de l’identité de genre, etc. Si vous avez un handicap ou un besoin particulier nécessitant l’aménagement du poste de travail ou de l’horaire de travail, merci de nous le faire savoir en remplissant ce formulaire.
Afin de pouvoir suivre en temps réel l'évolution de vos candidatures et pouvoir rester en contact avec nous, nous vous invitons à créer un compte candidat. Cela ne vous prendra pas plus d’une minute et vous permettra également de faciliter vos prochaines candidatures.

En soumettant votre CV ou votre candidature, vous autorisez Renault Group à utiliser et stocker des informations vous concernant à des fins de suivi de votre candidature ou de futurs emplois. Ces informations ne seront utilisées que par les sociétés de Renault Group tel que mentionné dans la
Politique Groupe de protection des données personnelles
.
&nbsp;"
12,France,https://www.indeed.fr/rc/clk?jk=78648e20bc463822&bb=vo8bM3VJ_e5-ZWMcwV_OvTdLJTlF-djQcmudvy2t-DjwQiGmPRf_KnE7ZAnt-laZ-Z1Imims8O54_HaJSYT01ywnhSvYwmKyAPiRDTXZnRStuue23BdJMuB0z3Jx1Bgw&xkcb=SoBj67M37J7TEFxqw50IbzkdCdPP&fccid=0a93917281835c59&vjs=3,Data+Analyst,Paris (75),DATA ANALYST SUPPLY CHAIN (H/F),ARIAL INDUSTRIES,91300 Massy,,"QUI SOMMES-NOUS ?

ARIAL INDUSTRIES, Créée en 2001, est une société d’ingénierie et d’assistance technique en forte croissance dans les métiers de la mécanique, de l’électricité et des systèmes embarqués. Nous intervenons sur le plan national et européen pour des programmes d’envergure auprès des grands comptes des secteurs aéronautique, automobile, spatial, énergies et défense

NOS VALEURS ?

Notre politique RH est construite autour d’un maître mot, l’Humain. Nous souhaitons promouvoir le sens du service et la réactivité, l’écoute et la reconnaissance.

NOS OPPORTUNITES / LES MISSIONS

Dans le cadre de nos projets dans le secteur de l’Aéronautique, nous recherchons un Data Analyst Supply chain (H/F).

Le poste est à pourvoir depuis Massy (91).

Les missions proposées sont les suivantes :
Comprendre et formaliser les problèmes spécifiques de la Supply Chain et les objectifs d'amélioration visés
Identifier, dans l’ERP, les sources de données qui correspondent aux problématiques à résoudre
Collecter et nettoyer les données sélectionnées
Mettre en place différentes techniques d'analyses des données (descriptive, tendance, prédictive, etc.)
Visualiser les résultats et proposer aux métiers des éléments de visualisation sous forme de graphiques dynamiques, tableaux et rapports
Suivre et mesurer/évaluer l'impact des solutions d'amélioration mises en place

PROFIL RECHERCHÉ

De formation Bac+5 spécialisé en Data Analyse, vous justifiez d’une première expérience de deux ans en milieu industriel en environnement Supply Chain.
Vous êtes spécialisé en Data Analyse et maitrisez les techniques Statistiques & Analyses de données
Vous savez utiliser les outils de Data Visualisation tel que Power BI
Les langages SQL, Python et R n’ont plus de secret pour vous
Vous connaissez les environnements ERP (SAP serait un plus non négligeable)
Vous êtes méthodique
Nous recherchons des profils dynamiques, rigoureux et ayant de fortes compétences relationnelles.

L’anglais est un plus sur ce poste.

SALAIRE ET AVANTAGES
Entre 38 à 45k€ brut par an en fonction du profil,
Contrat CDI
Vous bénéficiez d’une prise en charge à hauteur de 50% de la mutuelle entreprise, 100% pour la prévoyance,
Prime de cooptation, primes de vacances et autres primes
Paniers repas par mois,
RTT,
Participez à nos évènements et rencontrez toutes nos équipes Arial Industries,
Plateforme Avantages (cinéma, culture, jeux, multimédia, chèques cadeaux…).

VOS OPPORTUNITES CHEZ ARIAL INDUSTRIES

Pas de limitation ! Vous avez des objectifs professionnels ? Nous les définirons ensemble et serons heureux de vous aider à les atteindre.
Votre sérieux et motivation ouvriront les portes des missions qui vous intéressent.


PROCESSUS DE RECRUTEMENT

Etape 1 : Point téléphonique (10 minutes) avec le chargé de recrutement
Etape 2 : Entretien Teams (30 minutes) avec le chargé de recrutement
Etape 3 : Entretien (1h) avec le manager technique
Etape 4 : Intégration au sein de nos équipes



Nous garantissons de la réactivité et nous faisons en sorte de vous partager une réponse le plus vite possible !

En espérant vous compter parmi nous très prochainement.

Ref : C73O82544

&nbsp;"
12,France,https://www.indeed.fr/rc/clk?jk=4cf2ba93d5482d8b&bb=vo8bM3VJ_e5-ZWMcwV_OvbXmGoLO9gRmU24jpUhkn4CjfftLnPJyYPf75k100GU8-0GV26BMcuFdvdrJY2jcbVbuSLIPMGvituwqCvsB7_AzXYTUlkmnufXhZyjIIauU&xkcb=SoDt67M37J7TEFxqw50PbzkdCdPP&fccid=558b0bb186598a1e&vjs=3,Data+Analyst,Paris (75),STAGIAIRE BUSINESS ANALYSTE H/F,Caisse des Dépôts,75007 Paris,,"Au sein du département de l’ALM, le pôle Synthèse transverse de l’ALM Groupe CDC et fonds d’épargne a pour mission notamment : la vision transversale sur les sujets d’appétit aux risques, les sensibilités et les stress-tests ; le suivi de la cartographies des risques financiers et non financiers, la coordination des ICAAP / ILAAP ; la gestion et l’animation de projets et chantiers transverses au département liés aux risques ALM ; l’analyse des textes normatifs et réglementaires relatifs aux missions du département ; l’animation de la filière ALM auprès des filiales financières, la coordination des exercices de programmation financière pluriannuelle, la coordination des dispositifs de contrôle du département et à ce titre la gestion de la relation avec les différents corps de contrôle et le reporting associé.


Au sein du pôle Synthèse transverse, sous la supervision du référent des dispositifs de contrôles du département de gestion des bilans ALM, le stagiaire aura les missions suivantes :

Recenser les données produites destinées à la création d’une base de données couvrant les différents contrôles réalisés par les différents pôles du département de gestion des bilans ALM,
Identifier :
i) les variables clefs permettant les croisements entre les différents fichiers inputs
ii) les pivots à créer,
Proposer l’outil à mettre en place/ à développer pour la créer la base de données
Homogénéiser des données et des formats en vue de l’automatisation et de la mise en production de la base de données,
Développer des calculs et agrégations destinés à la production de différents reporting qui devront couvrir une profondeur d’historiques afin de mettre en avant les tendances,
Créer des tableaux de bords récurrents destinés aux présentations du service issues de la base données,
Analyser les variations et proposer de nouveaux axes d’analyses.
Profil attendu


Le recrutement à la Caisse des Dépôts est fondé sur les compétences, sans distinction d'origine, d'âge, ni de genre. Tous nos postes sont ouverts aux personnes en situation de handicap.

Profil recherché/Compétences requises

De formation supérieure dernière année d’ingénieur ou études scientifiques (Master 2), le/la candidat-e maîtrise les outils bureautiques (maitrise avancée d’excel), a une connaissance étroite des outils associés aux bases de données (création, structuration, exploitation) et des outils de requête / de traitement associées (SQL/Business Object, Tableau, Power BI, Alteryx ...). La connaissance de VBA et de Python est un plus.

Il/elle sait travailler dans un état d’esprit collaboratif et fait preuve de curiosité. De manière générale, une grande rigueur intellectuelle, un esprit de synthèse, des capacités d'expression écrite et orale ainsi qu’un sens de la pédagogie vis-à-vis de collaborateurs sans expérience « data ».


Conditions de travail

Offre à pourvoir uniquement pour un stage de 6 mois.

Lieu de travail : 15 Quai Anatole France 75007 PARIS"
12,France,https://www.indeed.fr/rc/clk?jk=d18b048d1d6257db&bb=vo8bM3VJ_e5-ZWMcwV_OvdCO41Jv8WYi-Z7SOQGdvcQanJWMMEMq8CDnjk164nc296EtoeVrW4FqGn4NviGFu-TtD2uBz5DzPWn7cjcchmmzMKNFe9cIw8WCAmEPbteO&xkcb=SoBZ67M37J7TEFxqw50ObzkdCdPP&fccid=1ad83847e7e3b3ca&vjs=3,Data+Analyst,Paris (75),DATA ANALYST (H/F) - CDI - NANTERRE (92),GAN ASSURANCES,Nanterre (92),,"Gan Assurances, filiale du Groupe Groupama, est une entreprise à taille humaine qui constitue, grâce à un collectif de 5 000 personnes, le 5e réseau français d'Agents généraux.

Rejoindre Gan Assurances, c'est avoir à la fois l'opportunité d'évoluer dans un environnement convivial et bienveillant mais aussi de monter en compétences sur des missions porteuses de sens. La confiance, la proximité, la détermination et l'efficacité sont les 4 valeurs partagées par l'ensemble de nos collaborateurs au quotidien.

Le Datalab de Gan Assurances est composé de 30 personnes en charge des extractions, tableaux de bord et analyses statistiques au service de la Direction Générale et de tous les métiers de l'entreprise.

Il a en charge la production de Data et Analyses au sein de l'entreprise au travers de ses 3 pôles : Technique & Financier, Commercial et Opérationnel & Parcours Indemnisation. Composé de spécialistes du data mining, de la Dataviz ou de la Bi, le Datalab centralise les outils d'aide à la décision de l'entreprise et diffuse la culture de pilotage.

Le pôle Technique & Financier du Datalab recherche un(e) Data Analyst qui travaillera en étroite collaboration avec le métier technique. L'appartenance de notre équipe à la Direction Technique facilitera vos échanges et votre compréhension des projets et problématiques.

Vous travaillerez plus précisément sur 2 sujets :
La vision technique et les indicateurs de rentabilité (Sinistres / Primes)
Sur la vision technique, vous serez le référent au sein du pôle. Vous mettrez en place avec l'actuariat produit les indicateurs qui nous permettront de suivre la rentabilité de nos offres produits. Vous garantirez le calcul de ces indicateurs et développerez les restitutions attendues en y apportant votre expertise métier.

Les études et tableaux de bord du marché construction
Sur le marché Construction vous serez le référent technique de ce métier en participant à l'élaboration des tableaux de bord de Pilotage. Vous accompagnerez la Direction Construction dans ses besoins de pilotage (extraction, analyses et projets) en développant les outils et restitutions attendues.
Vous êtes diplômé d'un Master Traitement de Données et statistiques avec une composante financière ou actuarielle.
Vous justifiez d'une première expérience réussie de minimum 5 ans, dans le domaine du pilotage financier/technique dans le secteur des assurances.
Vous êtes expert du langage SAS/SQL et connaissez la solution de Dataviz Qlik ou équivalent. Des notions du langage R seraient un plus.
Le processus de recrutement :
Préqualification téléphonique avec la RH Eléonore
Un entretien RH via Teams avec Eléonore
Un 1er entretien Manager avec Akli ou Mikael
Un 2ème entretien manager avec Maryline et Sabrina
Les recrutements de Gan Assurances reposent sur une politique de recrutement inclusive et diversifiée ainsi que sur le respect fondamental du principe de non-discrimination et d'égalité de traitement des candidatures.

Vous souhaitez en savoir plus sur Gan Assurances ? Patrick BURTIN, Directeur de la Stratégie vous présente en quelques mots notre belle entreprise.

Vous vous reconnaissez dans ce profil ? N'hésitez plus, postulez et rejoignez l'équipe d'Akli et Stéphane !
&nbsp;"
12,France,https://www.indeed.fr/rc/clk?jk=6e8982e30120565f&bb=vo8bM3VJ_e5-ZWMcwV_OvYuwFFpSLrMcBTGMm6aJizWqtn6FcTiXrBS9uZOdE3rPrsgtOv84e0XmF3riIjY34wR6eUxD9F3ljNYmDwoci6SXiVPamtXRiCtWRGb5Q5rN&xkcb=SoDE67M37J7TEFxqw50NbzkdCdPP&fccid=47feb0effe4ed4f2&vjs=3,Data+Analyst,Paris (75),Data Analyst Intern,Match Group,Télétravail partiel à Paris (75),,"Meetic is the European leader in dating services operating across 21 countries.
As the source of more than 8 million couples, Meetic works to create the best user experience whether online, mobile or at the many events organized every week across Europe.

A company focusing on a human philosophy, supported by the strength of an international group, our teams develop products with a strong social impact.
In recent years, Meetic has placed people and sustainability at the center of its focus through concrete actions: such as a green IT approach (reduction of servers, web eco-design, zero plastic...), friendly work environment, emergency leaves, WFH policy, work-life balance etc…

Take a look at our page: https://www.meetic-europe.com/

The position:
Meetic relies heavily on data to manage its activities, and is constantly developing the use of this asset. In this context, the Data & Analytics team is at the crossroads of key developments.

Our mission is to design tomorrow's dating app to satisfy our millions of monthly users.

Our stack:
Databases : Oracle, PostgreSQL, HDFS
Languages : SQL, Python

We are looking for a Data Analysis intern to join the Meetic Data & Analytics team to help us improve our tools and daily analysis.

Depending on your profile and your start date within the company, you’ll work on:
The daily tasks of a data analyst:
AB test analysis and follow-up with the product managers
Creation of dashboards to monitor KPIs (QlikView).
Ad Hoc analysis to support the different business teams in their decision-making
Analysis tools developed internally:
Continuous improvement (code, adding new features)
Adapting tools to new data sources

Qualifications:
You are a student of an Engineering School and looking for a 5/6 months internship
Possess a strong sensitivity towards data analysis/statistics
You have a good command of SQL or are curious enough to learn it quickly.
You are programming in one or more languages
Working with Excel and Powerpoint doesn't scare you
You're curious, creative, proactive and open-minded
You are a strong team player with the ability to collaborate effectively in a fast-paced environment

What we offer:
A responsible and rewarding internship
Operate in an international and multicultural environment
A gorgeous working environment in the heart of Paris, spacious and modern office, rooftop, close to transport and amenities
Edenred lunch vouchers
Use our products free of charge
Enjoy work-life balance

Hiring Process:
A first 30-min Zoom conversation with Guillaume (Recruiter)
A 60-min meeting including a live use case with Marie (Data Analyst)
A final 60-min onsite or Zoom interview with Claire (Data Analytics Director) and Belinda (Sr People Manager)

On your initial days, the HR Team and your team will make sure you start under excellent conditions.

Practical information:
Contract start: As soon as you are ready!
Location: 53 Rue de Châteaudun, Paris 75009
Work From Home : Hybrid, between 2 and 3 days at the office per week
Contract: 5-6 months internship
Meetic is an employer that respects equal opportunities and diversity
&nbsp;"
